{
  "id": "https://example.com/posts/semantic-web-guide",
  "title": "Understanding the Semantic Web",
  "summary": "A comprehensive guide to semantic web technologies and their applications",
  "topics": [
    {
      "id": "technology",
      "label": "Technology",
      "global": "wikidata:Q739"
    }
  ],
  "tags": ["semantic-web", "rdf", "linked-data"],
  "lang": "en",
  "date": "2025-07-28",
  "version": "1.0.0",
  "digest": "abc123def456",
  "author": {
    "name": "Jane Doe",
    "id": "author:jane-doe",
    "ssot_id": "ssot:jane"
  },
  "publisher": {
    "name": "Tech Publications",
    "id": "publisher:techpub", 
    "uri": "https://techpub.example.com"
  },
  "license": "CC-BY-4.0",
  "canonical": "https://example.com/posts/semantic-web-guide",
  "endorsements": [],
  "archived": false
}